{
  "schema_version": "quantsmith-pin/1",
  "package": { "name": "quantsmith", "version": "0.1.0", "code_digest": "sha256:670ed7aed63f68ce4d975f95e81af076c1b714483d25d39aa9d7ba95e7df1930" },
  "assets": {
    "digest": "sha256:9f5648b89ed32f54bdfb7143f0a0fdb8f73e4713e855cd932dd2b88c669596f9",
    "paths": [
      "knowledge/analytics_packs",
      "knowledge/visualization_packs",
      "knowledge/short_term_markets",
      "agents/analytics",
      "agents/economists/macro_backdrop_summarizer",
      "agents/securities_financing",
      "templates/docs/macro_backdrop_report.md"
    ]
  },
  "reviewed": {
    "on": "2026-10-07",
    "source_commit": "c234119bbd123289bc0a872d9546686ab8cc894c",
    "note": "Informational. QuantSmith is supplied locally and never fetched."
  }
}
